InvoiceNo,StockCode,Description,Quantity,InvoiceDate,UnitPrice,CustomerID,Country
558707,23208,LUNCH BAG VINTAGE LEAF DESIGN,1,7/1/2011 12:58,1.65,12748.0,United Kingdom
580664,71459,HANGING JAM JAR T-LIGHT HOLDERS,12,12/5/2011 14:03,0.85,15097.0,United Kingdom
568046,22621,TRADITIONAL KNITTING NANCY,1,9/23/2011 12:16,1.65,18118.0,United Kingdom
569637,23238,SET OF 4 KNICK KNACK TINS LONDON ,6,10/5/2011 12:14,4.15,15757.0,United Kingdom
564727,22796,PHOTO FRAME 3 CLASSIC HANGING,2,8/28/2011 12:31,9.95,16686.0,United Kingdom
577744,20728,LUNCH BAG CARS BLUE,20,11/21/2011 13:58,1.65,18229.0,United Kingdom
567184,20754,RETROSPOT RED WASHING UP GLOVES,1,9/18/2011 15:41,2.1,16033.0,United Kingdom
576463,22144,CHRISTMAS CRAFT LITTLE FRIENDS,2,11/15/2011 11:37,2.1,17974.0,United Kingdom
554382,21829,DINOSAUR KEYRINGS ASSORTED,72,5/24/2011 11:55,0.21,17365.0,United Kingdom
579512,22701,PINK DOG BOWL,2,11/29/2011 16:47,2.46,,United Kingdom
541214,21845,DAIRY MAID STRIPE MUG,6,1/14/2011 13:41,2.95,15570.0,United Kingdom
558774,22741,FUNKY DIVA PEN,1,7/4/2011 10:17,1.63,,United Kingdom
566299,23267,SET OF 4 SANTA PLACE SETTINGS,12,9/11/2011 15:59,1.25,16871.0,United Kingdom
564479,22385,JUMBO BAG SPACEBOY DESIGN,10,8/25/2011 13:12,2.08,12682.0,France
536945,22132,RED LOVE HEART SHAPE CUP,2,12/3/2010 12:24,0.85,14083.0,United Kingdom
572669,22417,PACK OF 60 SPACEBOY CAKE CASES,1,10/25/2011 13:10,0.55,16549.0,United Kingdom
576600,21485,RETROSPOT HEART HOT WATER BOTTLE,3,11/15/2011 15:08,4.95,18181.0,United Kingdom
580730,22420,LIPSTICK PEN BABY PINK,1,12/5/2011 17:28,0.83,,United Kingdom
572329,22979,PANTRY WASHING UP BRUSH,12,10/24/2011 10:13,1.45,14019.0,United Kingdom
569206,85123A,WHITE HANGING HEART T-LIGHT HOLDER,2,10/2/2011 10:58,2.95,15038.0,United Kingdom
557217,20977,36 PENCILS TUBE WOODLAND,16,6/17/2011 12:30,1.25,17426.0,United Kingdom
581574,21257,VICTORIAN SEWING BOX MEDIUM,2,12/9/2011 12:09,7.95,12526.0,Germany
544942,22029,SPACEBOY BIRTHDAY CARD,12,2/25/2011 10:29,0.42,15544.0,United Kingdom
568135,23435,3 RAFFIA RIBBONS VINTAGE CHRISTMAS,3,9/23/2011 17:04,0.83,,United Kingdom
547485,22489,PACK OF 12 TRADITIONAL CRAYONS,3,3/23/2011 11:16,0.42,17019.0,United Kingdom
566221,84568,GIRLS ALPHABET IRON ON PATCHES ,10,9/9/2011 16:13,0.42,,United Kingdom
574076,22356,CHARLOTTE BAG PINK POLKADOT,2,11/2/2011 15:38,1.63,,United Kingdom
566869,23206,LUNCH BAG APPLE DESIGN,10,9/15/2011 13:20,1.65,13658.0,United Kingdom
548715,84251G,"GREETING CARD, OVERCROWDED POOL.",12,4/3/2011 15:22,0.19,17758.0,United Kingdom
573500,22996,TRAVEL CARD WALLET VINTAGE TICKET,6,10/31/2011 12:01,0.42,16931.0,United Kingdom
543121,22505,MEMO BOARD COTTAGE DESIGN,4,2/3/2011 13:58,4.95,12662.0,Germany
546891,84596J,MIXED NUTS LIGHT GREEN BOWL,1,3/17/2011 18:18,0.83,,United Kingdom
560212,22743,MAKE YOUR OWN FLOWERPOWER CARD KIT,1,7/15/2011 14:58,2.95,14722.0,United Kingdom
546542,21397,BLUE POLKADOT EGG CUP ,12,3/14/2011 15:13,0.39,13263.0,United Kingdom
563095,21703,BAG 125g SWIRLY MARBLES,12,8/12/2011 9:04,0.42,13158.0,United Kingdom
551698,23201,JUMBO BAG ALPHABET,200,5/3/2011 13:52,1.79,13694.0,United Kingdom
538509,22319,HAIRCLIPS FORTIES FABRIC ASSORTED,12,12/12/2010 13:37,0.65,14413.0,United Kingdom
569898,22743,MAKE YOUR OWN FLOWERPOWER CARD KIT,1,10/6/2011 16:08,5.79,,United Kingdom
571684,22579,WOODEN TREE CHRISTMAS SCANDINAVIAN,3,10/18/2011 14:11,0.29,16730.0,United Kingdom
580983,22445,PENCIL CASE LIFE IS BEAUTIFUL,1,12/6/2011 16:26,5.79,,United Kingdom
542303,84509B,SET OF 4 FAIRY CAKE PLACEMATS,4,1/27/2011 11:05,3.75,12539.0,Spain
571322,23200,JUMBO BAG PEARS,10,10/17/2011 11:05,2.08,13534.0,United Kingdom
C581460,22107,PIZZA PLATE IN BOX,-1,12/8/2011 18:48,1.25,13078.0,United Kingdom
561797,22149,FELTCRAFT 6 FLOWER FRIENDS,6,7/29/2011 13:37,2.1,13178.0,United Kingdom
545596,22557,PLASTERS IN TIN VINTAGE PAISLEY ,12,3/4/2011 10:49,1.65,14447.0,United Kingdom
545036,82578,KITCHEN METAL SIGN,2,2/25/2011 17:25,0.55,14573.0,United Kingdom
557210,22208,WOOD STAMP SET THANK YOU,2,6/17/2011 11:49,0.83,18118.0,United Kingdom
546317,21060,PARTY INVITES BALLOON GIRL,12,3/11/2011 9:07,0.85,14913.0,United Kingdom
550607,48194,DOORMAT HEARTS,2,4/19/2011 12:17,7.95,16919.0,United Kingdom
577469,22863,SOAP DISH BROCANTE,1,11/20/2011 11:25,2.95,15009.0,United Kingdom
577125,23497,CLASSIC CHROME BICYCLE BELL ,12,11/17/2011 18:43,1.45,12445.0,Spain
563076,21787,RAIN PONCHO RETROSPOT,144,8/11/2011 16:12,0.65,14646.0,Netherlands
540418,22817,CARD SUKI BIRTHDAY,17,1/7/2011 11:04,0.43,,United Kingdom
579510,84997C,CHILDRENS CUTLERY POLKADOT BLUE,4,11/29/2011 16:44,4.15,14554.0,United Kingdom
546520,21058,PARTY INVITES WOODLAND,12,3/14/2011 12:28,0.85,14911.0,EIRE
547788,21090,SET/6 COLLAGE PAPER PLATES,7,3/25/2011 12:00,0.83,,United Kingdom
571747,23206,LUNCH BAG APPLE DESIGN,10,10/19/2011 10:59,1.65,13849.0,United Kingdom
573339,23208,LUNCH BAG VINTAGE LEAF DESIGN,10,10/30/2011 11:49,1.65,13278.0,United Kingdom
564974,23300,GARDENERS KNEELING PAD CUP OF TEA ,2,8/31/2011 15:32,3.29,,United Kingdom
555854,22398,MAGNETS PACK OF 4 SWALLOWS,1,6/7/2011 13:47,1.25,12748.0,United Kingdom
547825,POST,POSTAGE,1,3/25/2011 15:01,15.0,12778.0,Netherlands
567074,84725,FREESTYLE CANVAS ART PICTURE,7,9/16/2011 12:22,0.75,17068.0,United Kingdom
543467,21313,GLASS HEART T-LIGHT HOLDER ,1,2/8/2011 14:35,1.63,,United Kingdom
545311,84946,ANTIQUE SILVER TEA GLASS ETCHED,12,3/1/2011 13:45,1.25,15660.0,United Kingdom
569524,23511,EMBROIDERED RIBBON REEL EMILY ,1,10/4/2011 14:42,2.08,14506.0,United Kingdom
578017,23339,EGG FRYING PAN BLUE ,1,11/22/2011 13:07,2.08,13569.0,United Kingdom
559948,22192,BLUE DINER WALL CLOCK,12,7/14/2011 10:41,7.65,12653.0,Israel
562200,23341,PINK DINER WALL CLOCK,2,8/3/2011 12:21,8.5,17719.0,United Kingdom
546884,22247,BUNNY DECORATION MAGIC GARDEN,1,3/17/2011 18:08,1.63,,United Kingdom
538307,22082,RIBBON REEL STRIPES DESIGN ,5,12/10/2010 13:27,1.65,14667.0,United Kingdom
577078,21787,RAIN PONCHO RETROSPOT,1,11/17/2011 15:17,1.63,,United Kingdom
550303,22969,HOMEMADE JAM SCENTED CANDLES,12,4/17/2011 10:21,1.45,18213.0,United Kingdom
565218,22077,6 RIBBONS RUSTIC CHARM,12,9/1/2011 17:45,1.65,12739.0,United Arab Emirates
573551,22867,HAND WARMER BIRD DESIGN,6,10/31/2011 13:35,2.1,15044.0,United Kingdom
565919,21380,WOODEN HAPPY BIRTHDAY GARLAND,2,9/7/2011 16:48,5.79,,United Kingdom
543010,84375,SET OF 20 KIDS COOKIE CUTTERS,12,2/2/2011 13:16,2.1,18250.0,United Kingdom
566087,84879,ASSORTED COLOUR BIRD ORNAMENT,16,9/9/2011 10:24,1.69,13319.0,United Kingdom
564141,22727,ALARM CLOCK BAKELIKE RED ,2,8/23/2011 11:47,3.75,17841.0,United Kingdom
537823,22739,RIBBON REEL CHRISTMAS SOCK BAUBLE,2,12/8/2010 14:25,3.36,,United Kingdom
546365,22281,EASTER TREE YELLOW BIRDS,4,3/11/2011 11:35,5.95,12520.0,Germany
548551,22904,CALENDAR PAPER CUT DESIGN,6,4/1/2011 8:56,2.95,14886.0,United Kingdom
575919,21867,PINK UNION JACK  LUGGAGE TAG,2,11/11/2011 17:00,1.25,15311.0,United Kingdom
575477,90175B,PINK GLASS CHUNKY CHARM BRACELET,1,11/9/2011 16:14,9.15,,United Kingdom
C553687,22241,GARLAND WOODEN HAPPY EASTER,-1,5/18/2011 14:01,1.06,15311.0,United Kingdom
539642,82600,NO SINGING METAL SIGN,2,12/20/2010 15:35,2.1,15867.0,United Kingdom
572499,23376,PACK OF 12 VINTAGE CHRISTMAS TISSUE,24,10/24/2011 14:10,0.39,15786.0,United Kingdom
536846,22272,FELTCRAFT DOLL MARIA,1,12/2/2010 19:59,2.95,14573.0,United Kingdom
552831,16015,MEDIUM CHINESE STYLE SCISSOR,30,5/11/2011 14:12,0.5,13052.0,United Kingdom
578331,21993,FLORAL FOLK STATIONERY SET,12,11/24/2011 8:44,1.25,14911.0,EIRE
566060,22410,MONEY BOX HOUSEKEEPING DESIGN,1,9/8/2011 15:27,2.46,,United Kingdom
C539661,15036,ASSORTED COLOURS SILK FAN,-48,12/21/2010 10:16,0.75,12971.0,United Kingdom
578783,22780,LIGHT GARLAND BUTTERFILES PINK,2,11/25/2011 11:58,4.25,12748.0,United Kingdom
556484,22961,JAM MAKING SET PRINTED,4,6/12/2011 13:17,1.45,16938.0,United Kingdom
554665,21830,ASSORTED CREEPY CRAWLIES,24,5/25/2011 14:44,0.42,14336.0,United Kingdom
541848,79191B,RETRO PLASTIC POLKA TRAY,1,1/23/2011 13:31,0.85,17611.0,United Kingdom
559051,22960,JAM MAKING SET WITH JARS,1,7/5/2011 16:47,8.29,,United Kingdom
541215,21947,SET OF 6 HEART CHOPSTICKS,12,1/14/2011 13:42,1.25,14329.0,United Kingdom
571697,23346,SPACEBOY BEAKER,12,10/18/2011 14:49,1.25,12759.0,Netherlands
546650,21187,WHITE BELL HONEYCOMB PAPER GARLAND ,3,3/15/2011 14:17,3.29,,United Kingdom
549713,22963,JAM JAR WITH GREEN LID,4,4/11/2011 14:11,0.85,17611.0,United Kingdom
574240,22296,HEART IVORY TRELLIS LARGE,6,11/3/2011 12:45,1.65,15998.0,United Kingdom
556244,22109,FULL ENGLISH BREAKFAST PLATE,3,6/9/2011 16:08,3.75,15867.0,United Kingdom
545685,22293,HANGING CHICK GREEN DECORATION,1,3/6/2011 11:55,1.45,14499.0,United Kingdom
557937,23182,TOILET SIGN OCCUPIED OR VACANT,2,6/23/2011 15:30,2.46,,United Kingdom
542608,22028,PENNY FARTHING BIRTHDAY CARD,12,1/30/2011 13:51,0.42,16770.0,United Kingdom
542100,22175,PINK OWL SOFT TOY,2,1/25/2011 13:15,2.95,15339.0,United Kingdom
580673,23529,WALL ART DOLLY GIRL ,6,12/5/2011 14:30,3.75,13089.0,United Kingdom
574240,23321,SMALL WHITE HEART OF WICKER,2,11/3/2011 12:45,1.65,15998.0,United Kingdom
576255,21811,HANGING HEART WITH BELL,23,11/14/2011 14:09,0.39,15993.0,United Kingdom
538657,22112,CHOCOLATE HOT WATER BOTTLE,2,12/13/2010 15:26,4.95,15867.0,United Kingdom
544338,21211,SET OF 72 SKULL PAPER  DOILIES,12,2/18/2011 8:47,1.45,12852.0,United Kingdom
567236,22192,BLUE DINER WALL CLOCK,2,9/19/2011 11:33,8.5,14735.0,United Kingdom
559051,20665,RED RETROSPOT PURSE ,1,7/5/2011 16:47,2.46,,United Kingdom
563193,22494,EMERGENCY FIRST AID TIN ,1,8/12/2011 16:30,2.46,,United Kingdom
577834,23485,BOTANICAL GARDENS WALL CLOCK ,4,11/22/2011 10:21,20.8,17528.0,United Kingdom
541104,90125E,AMBER BERTIE GLASS BEAD BAG CHARM,2,1/13/2011 14:29,1.63,,United Kingdom
543389,85173,SET/6 FROG PRINCE T-LIGHT CANDLES,1,2/8/2011 9:56,2.55,17841.0,United Kingdom
552668,20970,PINK FLORAL FELTCRAFT SHOULDER BAG,1,5/10/2011 15:05,7.46,,United Kingdom
578065,85099F,JUMBO BAG STRAWBERRY,1,11/22/2011 15:41,4.13,,United Kingdom
544106,22767,TRIPLE PHOTO FRAME CORNICE ,1,2/16/2011 10:47,9.95,14530.0,United Kingdom
547888,22978,PANTRY ROLLING PIN,6,3/28/2011 9:59,3.75,13368.0,United Kingdom
579512,22551,PLASTERS IN TIN SPACEBOY,1,11/29/2011 16:47,3.29,,United Kingdom
539760,22970,LONDON BUS COFFEE MUG,6,12/21/2010 17:16,2.55,17400.0,United Kingdom
560906,23161,REGENCY CAKE FORK,12,7/21/2011 17:55,1.25,15827.0,United Kingdom
564838,23086,ZINC  STAR T-LIGHT HOLDER ,2,8/30/2011 12:43,2.46,,United Kingdom
C548947,22180,RETROSPOT LAMP,-1,4/5/2011 10:45,9.95,14546.0,United Kingdom
548165,20713,JUMBO BAG OWLS,5,3/29/2011 13:44,4.13,,United Kingdom
575724,23355,HOT WATER BOTTLE KEEP CALM,4,11/10/2011 18:37,4.95,14608.0,United Kingdom
536943,22746,POPPY'S PLAYHOUSE LIVINGROOM ,1,12/3/2010 12:11,2.1,17884.0,United Kingdom
570273,23493,VINTAGE DOILY TRAVEL SEWING KIT,20,10/10/2011 10:51,1.95,13373.0,United Kingdom
577527,22273,FELTCRAFT DOLL MOLLY,3,11/20/2011 13:40,2.95,17523.0,United Kingdom
580292,22075,6 RIBBONS ELEGANT CHRISTMAS ,1,12/2/2011 13:37,0.39,15856.0,United Kingdom
547875,47590A,BLUE HAPPY BIRTHDAY BUNTING,6,3/27/2011 15:40,5.45,13408.0,United Kingdom
547042,90134,OLD ROSE COMBO BEAD NECKLACE,1,3/20/2011 11:00,2.9,,United Kingdom
576927,21558,SKULL LUNCH BOX WITH CUTLERY ,6,11/17/2011 11:02,2.55,12567.0,France
539451,21390,FILIGRIS HEART WITH BUTTERFLY,2,12/17/2010 16:59,2.51,,United Kingdom
536390,21086,SET/6 RED SPOTTY PAPER CUPS,48,12/1/2010 10:19,0.65,17511.0,United Kingdom
547669,15030,FAN BLACK FRAME ,5,3/24/2011 13:37,0.29,12748.0,United Kingdom
569332,22124,SET OF 2 TEA TOWELS PING MICROWAVE,1,10/3/2011 13:46,2.95,12637.0,France
557153,23172,REGENCY TEA PLATE PINK,3,6/17/2011 11:07,1.65,13735.0,United Kingdom
577516,20992,JAZZ HEARTS PURSE NOTEBOOK,3,11/20/2011 13:08,0.39,16533.0,United Kingdom
561485,84849A,HELLO SAILOR BLUE SOAP HOLDER,4,7/27/2011 13:42,1.69,17841.0,United Kingdom
540169,21258,VICTORIAN SEWING BOX LARGE,2,1/5/2011 12:20,12.75,14527.0,United Kingdom
546306,90028,NEW BAROQUE LARGE NECKLACE BLK/WHIT,2,3/10/2011 16:16,8.32,,United Kingdom
578020,22964,3 PIECE SPACEBOY COOKIE CUTTER SET,6,11/22/2011 13:20,2.1,16979.0,United Kingdom
547498,22384,LUNCH BAG PINK POLKADOT,1,3/23/2011 12:24,1.65,15021.0,United Kingdom
581456,22998,TRAVEL CARD WALLET KEEP CALM,12,12/8/2011 18:42,0.42,17530.0,United Kingdom
581498,21155,RED RETROSPOT PEG BAG,4,12/9/2011 10:26,4.96,,United Kingdom
538368,84536A,ENGLISH ROSE NOTEBOOK A7 SIZE,1,12/12/2010 10:57,0.42,15503.0,United Kingdom
561330,22969,HOMEMADE JAM SCENTED CANDLES,12,7/26/2011 14:03,1.45,16019.0,United Kingdom
555841,23158,SET OF 5 LUCKY CAT MAGNETS ,1,6/7/2011 12:47,2.08,14583.0,United Kingdom
537823,85016,SET OF 6 VINTAGE NOTELETS KIT,1,12/8/2010 14:25,2.51,,United Kingdom
552674,21116,OWL DOORSTOP,1,5/10/2011 15:07,8.29,,United Kingdom
571425,23056,FLOWERS CHANDELIER T-LIGHT HOLDER,3,10/17/2011 12:41,6.25,14911.0,EIRE
578067,22968,ROSE COTTAGE KEEPSAKE BOX ,2,11/22/2011 15:43,19.96,,United Kingdom
571328,85049A,TRADITIONAL CHRISTMAS RIBBONS,24,10/17/2011 11:27,1.25,12473.0,Germany
541241,84536A,ENGLISH ROSE NOTEBOOK A7 SIZE,32,1/16/2011 11:08,0.42,13782.0,United Kingdom
540468,20972,PINK CREAM FELT CRAFT TRINKET BOX ,1,1/7/2011 13:55,2.51,,United Kingdom
537334,22747,POPPY'S PLAYHOUSE BATHROOM,1,12/6/2010 12:06,2.1,16719.0,United Kingdom
575977,23148,MINIATURE ANTIQUE ROSE HOOK IVORY,12,11/13/2011 13:27,0.83,17287.0,United Kingdom
558237,23298,SPOTTY BUNTING,1,6/27/2011 15:04,4.95,12867.0,United Kingdom
541104,22586,FELTCRAFT HAIRBAND PINK AND BLUE,1,1/13/2011 14:29,1.63,,United Kingdom
541567,85014B,RED RETROSPOT UMBRELLA,3,1/19/2011 11:51,5.95,12681.0,France
581439,22791,T-LIGHT GLASS FLUTED ANTIQUE,9,12/8/2011 16:30,2.46,,United Kingdom
543023,21733,RED HANGING HEART T-LIGHT HOLDER,12,2/2/2011 14:38,2.95,15270.0,United Kingdom
553050,21928,JUMBO BAG SCANDINAVIAN BLUE PAISLEY,10,5/13/2011 10:09,2.08,15498.0,United Kingdom
564725,23313,VINTAGE CHRISTMAS BUNTING,2,8/28/2011 12:28,4.95,18041.0,United Kingdom
540995,22403,MAGNETS PACK OF 4 VINTAGE LABELS ,3,1/13/2011 9:30,0.83,,United Kingdom
550318,85049C,ROMANTIC PINKS RIBBONS ,3,4/17/2011 12:25,1.25,16085.0,United Kingdom
575176,85199S,SMALL HANGING IVORY/RED WOOD BIRD,2,11/8/2011 18:29,0.83,,United Kingdom
545217,22883,NUMBER TILE VINTAGE FONT 4,1,2/28/2011 16:59,4.13,,United Kingdom
551172,47566,PARTY BUNTING,2,4/26/2011 16:53,4.95,17854.0,United Kingdom
562024,84951A,SET OF 4 PISTACHIO LOVEBIRD COASTER,1,8/1/2011 16:07,2.46,,United Kingdom
577286,21944,KITTENS DESIGN FLANNEL,2,11/18/2011 12:39,0.85,14606.0,United Kingdom
549125,90180B,PURPLE AMETHYST NECKLACE W TASSEL,1,4/6/2011 14:13,9.95,14964.0,United Kingdom
560225,23053,RECYCLED ACAPULCO MAT PINK,1,7/15/2011 16:27,16.63,,United Kingdom
546127,21535,RED RETROSPOT SMALL MILK JUG,12,3/9/2011 14:57,2.55,17730.0,United Kingdom
574317,17038,PORCELAIN BUDAH INCENSE HOLDER,100,11/3/2011 18:49,0.1,17078.0,United Kingdom
C548972,22784,LANTERN CREAM GAZEBO ,-3,4/5/2011 11:42,4.95,15674.0,United Kingdom
574883,22693,GROW A FLYTRAP OR SUNFLOWER IN TIN,48,11/7/2011 13:56,1.25,14623.0,United Kingdom
573315,22748,POPPY'S PLAYHOUSE KITCHEN,1,10/28/2011 17:27,2.1,17839.0,United Kingdom
572127,22221,CAKE STAND LOVEBIRD 2 TIER PINK,2,10/21/2011 9:20,9.95,14911.0,EIRE
555280,22296,HEART IVORY TRELLIS LARGE,12,6/2/2011 9:02,1.65,17162.0,United Kingdom
550819,82482,WOODEN PICTURE FRAME WHITE FINISH,4,4/20/2011 17:37,2.55,17530.0,United Kingdom
540813,85177,BASKET OF FLOWERS SEWING KIT,6,1/11/2011 12:41,0.85,14669.0,United Kingdom
553870,84947,ANTIQUE SILVER TEA GLASS ENGRAVED,24,5/19/2011 14:29,1.25,17980.0,United Kingdom
566193,20914,SET/5 RED RETROSPOT LID GLASS BOWLS,6,9/9/2011 13:37,2.95,14961.0,United Kingdom
544681,22998,TRAVEL CARD WALLET KEEP CALM,5,2/22/2011 16:28,0.83,,United Kingdom
554824,47590B,PINK HAPPY BIRTHDAY BUNTING,12,5/26/2011 14:21,5.45,15785.0,United Kingdom
570690,22598,CHRISTMAS MUSICAL ZINC TREE,3,10/11/2011 16:37,0.83,,United Kingdom
556459,20667,CHERRY BLOSSOM PURSE,1,6/10/2011 17:25,2.46,,United Kingdom
541130,21094,SET/6 RED SPOTTY PAPER PLATES,3,1/14/2011 10:15,2.46,,United Kingdom
571270,23427,STOOL HOME SWEET HOME ,1,10/16/2011 12:09,12.5,12940.0,United Kingdom
564342,23168,CLASSIC CAFE SUGAR DISPENSER,1,8/24/2011 14:53,1.25,16340.0,United Kingdom
562850,20725,LUNCH BAG RED RETROSPOT,100,8/10/2011 10:08,1.45,14680.0,United Kingdom
558367,84828,JUNGLE POPSICLES ICE LOLLY MOULDS,12,6/28/2011 15:31,1.25,16550.0,United Kingdom
539395,22923,FRIDGE MAGNETS LES ENFANTS ASSORTED,36,12/17/2010 11:52,0.85,12471.0,Germany
537030,22587,FELTCRAFT HAIRBAND RED AND BLUE,12,12/3/2010 16:44,0.85,16455.0,United Kingdom
C556640,22283,6 EGG HOUSE PAINTED WOOD,-2,6/13/2011 15:44,7.95,13148.0,United Kingdom
539317,22443,GROW YOUR OWN HERBS SET OF 3,1,12/16/2010 19:04,7.95,17392.0,United Kingdom
577405,22468,BABUSHKA LIGHTS STRING OF 10,4,11/20/2011 10:29,6.75,14116.0,United Kingdom
544887,22750,FELTCRAFT PRINCESS LOLA DOLL,4,2/24/2011 11:54,3.75,17364.0,United Kingdom
580729,21810,CHRISTMAS HANGING STAR WITH BELL,14,12/5/2011 17:24,0.83,,United Kingdom
575693,23080,RED METAL BOX TOP SECRET,2,11/10/2011 16:36,8.25,16979.0,United Kingdom
560434,21442,GREEN BIRDHOUSE DECORATION,2,7/18/2011 15:56,1.63,,United Kingdom
556728,23245,SET OF 3 REGENCY CAKE TINS,1,6/14/2011 11:36,4.95,15719.0,United Kingdom
539451,22910,PAPER CHAIN KIT VINTAGE CHRISTMAS,9,12/17/2010 16:59,3.36,,United Kingdom
580752,22750,FELTCRAFT PRINCESS LOLA DOLL,4,12/6/2011 9:56,3.75,12478.0,Greece
545445,22301,COFFEE MUG CAT + BIRD DESIGN,6,3/2/2011 16:26,2.55,17738.0,United Kingdom
547655,22956,36 FOIL HEART CAKE CASES,6,3/24/2011 12:52,2.1,14267.0,United Kingdom
557612,20840,FRENCH FLORAL CUSHION COVER ,24,6/21/2011 12:40,0.85,14460.0,United Kingdom
560034,23198,PANTRY MAGNETIC  SHOPPING LIST,12,7/14/2011 13:35,1.45,13933.0,United Kingdom
567579,23394,POSTE FRANCE CUSHION COVER,4,9/21/2011 10:48,3.75,18228.0,United Kingdom
567818,23321,SMALL WHITE HEART OF WICKER,8,9/22/2011 12:41,1.65,14395.0,United Kingdom
551963,85132A,CHARLIE + LOLA BISCUITS TINS,48,5/5/2011 12:52,1.95,13266.0,United Kingdom
540096,21617,4 LILY  BOTANICAL DINNER CANDLES,12,1/4/2011 15:43,1.25,13253.0,United Kingdom
568310,23180,MUM'S KITCHEN CLOCK,4,9/26/2011 12:48,4.95,14911.0,EIRE
544684,22558,CLOTHES PEGS RETROSPOT PACK 24 ,3,2/22/2011 16:32,2.46,,United Kingdom
564746,23032,DRAWER KNOB CRACKLE GLAZE IVORY,6,8/28/2011 15:58,1.65,17633.0,United Kingdom
539737,22207,FRYING PAN UNION FLAG,3,12/21/2010 15:19,8.47,,United Kingdom
561205,21992,VINTAGE PAISLEY STATIONERY SET,12,7/25/2011 15:48,1.25,17693.0,United Kingdom
574532,22736,RIBBON REEL MAKING SNOWMEN ,10,11/4/2011 14:19,1.65,15676.0,United Kingdom
554808,82582,AREA PATROLLED METAL SIGN,3,5/26/2011 13:01,2.1,17059.0,United Kingdom
550477,22692,DOORMAT WELCOME TO OUR HOME,2,4/18/2011 14:01,7.95,17338.0,United Kingdom
557324,22653,BUTTON BOX ,1,6/20/2011 9:41,4.13,,United Kingdom
580695,22144,CHRISTMAS CRAFT LITTLE FRIENDS,1,12/5/2011 16:03,2.1,13230.0,United Kingdom
539439,85062,PEARL CRYSTAL PUMPKIN T-LIGHT HLDR,12,12/17/2010 15:14,1.65,13869.0,United Kingdom
568543,84920,,-21,9/27/2011 14:33,0.0,,United Kingdom
571562,22382,LUNCH BAG SPACEBOY DESIGN ,20,10/18/2011 10:04,1.65,14156.0,EIRE
552560,22084,PAPER CHAIN KIT EMPIRE,6,5/10/2011 11:48,2.95,17581.0,United Kingdom
551997,22367,CHILDRENS APRON SPACEBOY DESIGN,2,5/5/2011 15:47,4.13,,United Kingdom
541987,84378,SET OF 3 HEART COOKIE CUTTERS,2,1/24/2011 16:05,1.25,14130.0,United Kingdom
559052,21905,MORE BUTTER METAL SIGN ,1,7/5/2011 16:53,1.63,,United Kingdom
536590,21340,CLASSIC METAL BIRDCAGE PLANT HOLDER,1,12/1/2010 16:52,12.75,13065.0,United Kingdom
537645,22947,WOODEN ADVENT CALENDAR RED,1,12/7/2010 15:34,34.0,,United Kingdom
565766,22171,3 HOOK PHOTO SHELF ANTIQUE WHITE,1,9/6/2011 14:23,8.5,17841.0,United Kingdom
566976,22943,CHRISTMAS LIGHTS 10 VINTAGE BAUBLES,12,9/16/2011 9:27,4.95,15382.0,United Kingdom
540185,22052,VINTAGE CARAVAN GIFT WRAP,25,1/5/2011 13:40,0.42,14653.0,United Kingdom
544434,22212,FOUR HOOK  WHITE LOVEBIRDS,1,2/18/2011 16:12,4.13,,United Kingdom
574103,85066,CREAM SWEETHEART MINI CHEST,2,11/3/2011 10:30,12.75,13636.0,United Kingdom
569148,21791,VINTAGE HEADS AND TAILS CARD GAME ,12,9/30/2011 15:52,1.25,16613.0,United Kingdom
553199,20686,DOLLY MIXTURE CHILDREN'S UMBRELLA,2,5/15/2011 15:13,3.25,17758.0,United Kingdom
537463,21124,SET/10 BLUE POLKADOT PARTY CANDLES,24,12/7/2010 10:08,1.25,12681.0,France
560366,21829,DINOSAUR KEYRINGS ASSORTED,36,7/18/2011 12:19,0.21,16859.0,United Kingdom
546983,22464,HANGING METAL HEART LANTERN,12,3/18/2011 12:27,1.65,16626.0,United Kingdom
553769,23444,,200,5/19/2011 10:48,0.0,,United Kingdom
565767,84031A,CHARLIE+LOLA RED HOT WATER BOTTLE ,1,9/6/2011 14:28,4.96,,United Kingdom
569415,21936,RED RETROSPOT PICNIC BAG,1,10/4/2011 10:14,5.79,,United Kingdom
538566,84029E,RED WOOLLY HOTTIE WHITE HEART.,2,12/13/2010 11:21,7.62,,United Kingdom
573137,22028,PENNY FARTHING BIRTHDAY CARD,2,10/27/2011 17:15,0.83,,United Kingdom
558637,22315,200 RED + WHITE BENDY STRAWS,1,6/30/2011 20:08,1.25,17891.0,United Kingdom
570466,22798,ANTIQUE GLASS DRESSING TABLE POT,2,10/10/2011 16:03,2.95,16791.0,United Kingdom
573633,84879,ASSORTED COLOUR BIRD ORNAMENT,8,10/31/2011 15:48,3.12,,United Kingdom
537223,22112,CHOCOLATE HOT WATER BOTTLE,6,12/5/2010 16:10,4.95,13579.0,United Kingdom
569523,23512,EMBROIDERED RIBBON REEL ROSIE,1,10/4/2011 14:41,2.08,16033.0,United Kingdom
576381,22699,ROSES REGENCY TEACUP AND SAUCER ,6,11/15/2011 9:26,2.95,12839.0,United Kingdom
548458,22690,DOORMAT HOME SWEET HOME BLUE ,2,3/31/2011 11:53,7.95,15632.0,United Kingdom
574481,21094,SET/6 RED SPOTTY PAPER PLATES,3,11/4/2011 12:45,0.85,18022.0,United Kingdom
574251,23402,HOME SWEET HOME 3 PEG HANGER ,8,11/3/2011 13:22,3.75,18205.0,United Kingdom
547880,21137,BLACK RECORD COVER FRAME,12,3/27/2011 16:05,3.75,15426.0,United Kingdom
537823,21494,ROTATING LEAVES T-LIGHT HOLDER,1,12/8/2010 14:25,5.06,,United Kingdom
551821,84970S,HANGING HEART ZINC T-LIGHT HOLDER,12,5/4/2011 12:20,0.85,16942.0,United Kingdom
570242,23048,SET OF 10 LANTERNS FAIRY LIGHT STAR,200,10/9/2011 15:40,3.75,16380.0,United Kingdom
578285,20728,LUNCH BAG CARS BLUE,1,11/23/2011 13:57,1.65,12748.0,United Kingdom
580974,22865,HAND WARMER OWL DESIGN,12,12/6/2011 15:17,2.1,14293.0,United Kingdom
545688,22773,GREEN DRAWER KNOB ACRYLIC EDWARDIAN,12,3/6/2011 12:42,1.25,16033.0,United Kingdom
580043,23395,BELLE JARDINIERE CUSHION COVER,2,12/1/2011 12:25,3.75,14527.0,United Kingdom
541883,22413,METAL SIGN TAKE IT OR LEAVE IT ,12,1/24/2011 10:56,2.95,13408.0,United Kingdom
C557637,22778,GLASS CLOCHE SMALL,-1,6/21/2011 16:00,3.95,13630.0,United Kingdom
578289,23157,SET OF 6 NATIVITY MAGNETS ,2,11/23/2011 14:07,2.08,17841.0,United Kingdom
556721,21175,GIN + TONIC DIET METAL SIGN,12,6/14/2011 11:23,2.55,15218.0,United Kingdom
571443,22940,FELTCRAFT CHRISTMAS FAIRY,3,10/17/2011 13:43,4.25,17785.0,United Kingdom
576394,21770,OPEN CLOSED METAL SIGN,36,11/15/2011 10:32,4.25,12415.0,Australia
546522,22328,ROUND SNACK BOXES SET OF 4 FRUITS ,6,3/14/2011 12:41,2.95,13319.0,United Kingdom
572514,20774,,-4,10/24/2011 14:36,0.0,,United Kingdom
542255,21535,RED RETROSPOT SMALL MILK JUG,1,1/26/2011 16:43,4.96,,United Kingdom
544311,22602,RETROSPOT WOODEN HEART DECORATION,1,2/17/2011 14:19,0.85,17841.0,United Kingdom
540247,84879,ASSORTED COLOUR BIRD ORNAMENT,8,1/5/2011 15:56,1.69,15464.0,United Kingdom
574660,22558,CLOTHES PEGS RETROSPOT PACK 24 ,1,11/6/2011 11:55,1.65,15407.0,United Kingdom
544201,84509a,SET OF 4 ENGLISH ROSE PLACEMATS,1,2/17/2011 10:11,7.46,,United Kingdom
564066,23240,SET OF 4 KNICK KNACK TINS DOILY ,6,8/22/2011 15:05,4.15,17703.0,United Kingdom
544434,22549,PICTURE DOMINOES,1,2/18/2011 16:12,3.29,,United Kingdom
554546,22713,CARD I LOVE LONDON ,7,5/25/2011 9:37,0.42,,United Kingdom
538057,22418,10 COLOUR SPACEBOY PEN,24,12/9/2010 13:38,0.85,13102.0,United Kingdom
568705,23284,DOORMAT KEEP CALM AND COME IN,20,9/28/2011 15:31,7.08,14434.0,United Kingdom
558738,21828,EIGHT PIECE SNAKE  SET,12,7/1/2011 15:35,1.25,12922.0,United Kingdom
550541,85198,ASSORTED FARMYARD ANIMALS IN BUCKET,2,4/19/2011 11:33,1.63,,United Kingdom
570473,23122,PARTY CHARMS 50 PIECES,1,10/10/2011 16:41,0.83,,United Kingdom
568675,20724,RED RETROSPOT CHARLOTTE BAG,30,9/28/2011 13:32,0.72,14298.0,United Kingdom
574672,23307,SET OF 60 PANTRY DESIGN CAKE CASES ,2,11/6/2011 12:25,0.55,13532.0,United Kingdom
569202,22650,CERAMIC PIRATE CHEST MONEY BANK,1,9/30/2011 17:22,3.29,,United Kingdom
565932,22082,RIBBON REEL STRIPES DESIGN ,5,9/8/2011 10:35,1.65,16418.0,United Kingdom
565232,22135,MINI LADLE LOVE HEART PINK,1,9/2/2011 9:30,0.83,,United Kingdom
563858,22913,RED COAT RACK PARIS FASHION,3,8/19/2011 16:04,4.95,18170.0,United Kingdom
560996,47566,PARTY BUNTING,2,7/22/2011 13:53,4.95,17625.0,United Kingdom
570841,85099B,JUMBO BAG RED RETROSPOT,20,10/12/2011 14:18,2.08,12553.0,France
541568,22371,AIRLINE BAG VINTAGE TOKYO 78,12,1/19/2011 12:07,3.75,15606.0,United Kingdom
575955,22158,3 HEARTS HANGING DECORATION RUSTIC,1,11/13/2011 12:05,2.95,14044.0,United Kingdom
537254,22578,WOODEN STAR CHRISTMAS SCANDINAVIAN,1,12/6/2010 11:01,0.85,15898.0,United Kingdom
561651,21447,12 IVORY ROSE PEG PLACE SETTINGS,7,7/28/2011 15:36,2.46,,United Kingdom
543492,22986,GINGHAM ROSE WRAP,25,2/9/2011 10:41,0.42,12720.0,Germany
574573,22605,WOODEN CROQUET GARDEN SET,1,11/4/2011 16:35,14.95,14592.0,United Kingdom
566249,20972,PINK CREAM FELT CRAFT TRINKET BOX ,6,9/11/2011 12:09,1.25,13527.0,United Kingdom
558066,22385,JUMBO BAG SPACEBOY DESIGN,1,6/24/2011 15:45,4.13,,United Kingdom
543919,20725,LUNCH BAG RED RETROSPOT,10,2/14/2011 14:03,1.65,13157.0,United Kingdom
555488,22189,CREAM HEART CARD HOLDER,1,6/3/2011 13:43,3.95,16942.0,United Kingdom
