InvoiceNo,StockCode,Description,Quantity,InvoiceDate,UnitPrice,CustomerID,Country
548507,22957,SET 3 PAPER VINTAGE CHICK PAPER EGG,3,3/31/2011 14:47,2.95,13573.0,United Kingdom
560433,90129E,PURPLE GLASS TASSLE BAG CHARM,2,7/18/2011 15:49,1.63,,United Kingdom
575900,23005,TRAVEL CARD WALLET I LOVE LONDON,1,11/11/2011 15:14,0.42,,United Kingdom
574950,23328,SET 6 SCHOOL MILK BOTTLES IN CRATE,8,11/8/2011 9:29,7.46,,United Kingdom
553120,22729,ALARM CLOCK BAKELIKE ORANGE,4,5/13/2011 12:12,3.75,17139.0,United Kingdom
542345,21232,STRAWBERRY CERAMIC TRINKET BOX,2,1/27/2011 11:55,1.25,15910.0,United Kingdom
C553914,84279P,CHERRY BLOSSOM  DECORATIVE FLASK,-2,5/19/2011 19:50,3.75,18109.0,United Kingdom
540489,21755,LOVE BUILDING BLOCK WORD,3,1/7/2011 16:32,5.95,13593.0,United Kingdom
575610,20866,BLUE ROSE FABRIC MIRROR,12,11/10/2011 12:45,1.25,16628.0,United Kingdom
C571059,85066,CREAM SWEETHEART MINI CHEST,-1,10/13/2011 14:27,12.75,17813.0,United Kingdom
545305,46775D,SUNSET COLOUR CHUNKY KNITTED THROW,2,3/1/2011 12:58,16.95,15257.0,United Kingdom
571709,23188,VINTAGE  2 METRE FOLDING RULER,12,10/18/2011 15:52,1.65,16463.0,United Kingdom
557892,21713,CITRONELLA CANDLE FLOWERPOT,4,6/23/2011 14:11,2.1,14534.0,United Kingdom
575477,21231,SWEETHEART CERAMIC TRINKET BOX,1,11/9/2011 16:14,2.46,,United Kingdom
565231,20713,JUMBO BAG OWLS,1,9/2/2011 9:26,4.13,,United Kingdom
573267,72802C,VANILLA SCENT CANDLE JEWELLED BOX,3,10/28/2011 12:44,4.25,,United Kingdom
566949,22703,PINK CAT BOWL,1,9/15/2011 16:32,1.63,,United Kingdom
539450,22072,RED RETROSPOT TEA CUP AND SAUCER ,3,12/17/2010 16:53,3.75,15570.0,United Kingdom
578934,22114,HOT WATER BOTTLE TEA AND SYMPATHY,2,11/27/2011 12:47,4.25,14577.0,United Kingdom
538836,22141,CHRISTMAS CRAFT TREE TOP ANGEL,80,12/14/2010 13:09,1.85,12748.0,United Kingdom
577749,22614,PACK OF 12 SPACEBOY TISSUES,12,11/21/2011 14:26,0.39,16242.0,United Kingdom
562132,22908,PACK OF 20 NAPKINS RED APPLES,12,8/3/2011 9:40,0.85,13384.0,United Kingdom
572475,22090,PAPER BUNTING RETROSPOT,1,10/24/2011 13:37,2.95,15271.0,United Kingdom
565759,23404,HOME SWEET HOME BLACKBOARD,6,9/6/2011 13:46,4.95,12720.0,Germany
576837,23537,WALL ART I LOVE LONDON ,1,11/16/2011 15:16,10.79,,United Kingdom
555260,21868,POTTING SHED TEA MUG,3,6/1/2011 15:34,1.25,13263.0,United Kingdom
577482,22375,AIRLINE BAG VINTAGE JET SET BROWN,2,11/20/2011 11:43,4.25,16762.0,United Kingdom
560231,21524,DOORMAT SPOTTY HOME SWEET HOME,4,7/17/2011 10:55,7.95,13305.0,United Kingdom
570668,22659,LUNCH BOX I LOVE LONDON,4,10/11/2011 14:34,1.95,17837.0,United Kingdom
579694,23353,6 GIFT TAGS VINTAGE CHRISTMAS ,6,11/30/2011 14:11,1.63,,United Kingdom
546884,22678,FRENCH BLUE METAL DOOR SIGN 3,2,3/17/2011 18:08,2.46,,United Kingdom
563538,22212,FOUR HOOK  WHITE LOVEBIRDS,2,8/17/2011 11:48,2.1,17841.0,United Kingdom
574561,22326,ROUND SNACK BOXES SET OF4 WOODLAND ,1,11/4/2011 15:52,5.79,,United Kingdom
555946,21245,GREEN POLKADOT PLATE ,2,6/8/2011 10:43,1.69,17238.0,United Kingdom
562113,21471,STRAWBERRY RAFFIA FOOD COVER,4,8/2/2011 16:11,3.29,,United Kingdom
539985,84029G,KNITTED UNION FLAG HOT WATER BOTTLE,24,12/23/2010 15:16,3.39,15856.0,United Kingdom
571360,23146,TRIPLE HOOK ANTIQUE IVORY ROSE,4,10/17/2011 11:51,3.29,16563.0,United Kingdom
557798,22356,CHARLOTTE BAG PINK POLKADOT,10,6/23/2011 9:38,0.85,16187.0,United Kingdom
562553,17012D,ORIGAMI ROSE INCENSE/CANDLE SET ,1,8/5/2011 16:34,2.46,,United Kingdom
552364,84991,60 TEATIME FAIRY CAKE CASES,24,5/9/2011 12:25,0.55,13004.0,United Kingdom
569493,84946,ANTIQUE SILVER T-LIGHT GLASS,12,10/4/2011 13:35,1.25,13317.0,United Kingdom
562033,23175,REGENCY MILK JUG PINK ,6,8/2/2011 8:49,3.25,15410.0,United Kingdom
560357,23203,JUMBO BAG DOILEY PATTERNS,10,7/18/2011 11:42,2.08,15527.0,United Kingdom
538854,22191,IVORY DINER WALL CLOCK,2,12/14/2010 13:44,8.5,13102.0,United Kingdom
575848,23367,SET 12 COLOUR PENCILS SPACEBOY ,6,11/11/2011 12:10,0.65,14178.0,United Kingdom
562602,23028,DRAWER KNOB CRACKLE GLAZE BLUE,12,8/8/2011 10:11,1.65,12865.0,Austria
561794,22989,SET 2 PANTRY DESIGN TEA TOWELS,6,7/29/2011 13:11,3.25,12921.0,United Kingdom
559300,23309,SET OF 60 I LOVE LONDON CAKE CASES ,24,7/7/2011 12:40,0.55,12471.0,Germany
545701,48138,DOORMAT UNION FLAG,10,3/6/2011 15:17,6.75,17107.0,United Kingdom
548708,21171,BATHROOM METAL SIGN ,4,4/3/2011 12:41,1.45,13269.0,United Kingdom
543399,84969,BOX OF 6 ASSORTED COLOUR TEASPOONS,2,2/8/2011 11:07,3.29,,United Kingdom
580778,22818,CARD CHRISTMAS VILLAGE,12,12/6/2011 11:07,0.42,16949.0,United Kingdom
540461,22417,PACK OF 60 SPACEBOY CAKE CASES,24,1/7/2011 12:44,0.55,15139.0,United Kingdom
560926,21430,SET/3 RED GINGHAM ROSE STORAGE BOX,2,7/22/2011 9:20,7.46,,United Kingdom
548510,22333,RETROSPOT PARTY BAG + STICKER SET,3,3/31/2011 15:02,1.65,17861.0,United Kingdom
551277,85123A,WHITE HANGING HEART T-LIGHT HOLDER,4,4/27/2011 13:06,2.95,13637.0,United Kingdom
577730,23298,SPOTTY BUNTING,2,11/21/2011 12:59,4.95,17253.0,United Kingdom
578347,23294,SET OF 6 SNACK LOAF BAKING CASES,1,11/24/2011 9:26,2.46,,United Kingdom
553831,22637,PIGGY BANK RETROSPOT ,6,5/19/2011 11:36,2.55,14442.0,Channel Islands
548987,22084,PAPER CHAIN KIT EMPIRE,1,4/5/2011 12:50,2.95,14535.0,United Kingdom
563017,23209,LUNCH BAG VINTAGE DOILY ,10,8/11/2011 12:48,1.65,13198.0,United Kingdom
565967,21121,SET/10 RED POLKADOT PARTY CANDLES,48,9/8/2011 11:27,1.25,14646.0,Netherlands
569246,21880,RED RETROSPOT TAPE,1,10/3/2011 9:57,0.42,14096.0,United Kingdom
544684,22116,METAL SIGN HIS DINNER IS SERVED,1,2/22/2011 16:32,1.63,,United Kingdom
562928,22139,RETROSPOT TEA SET CERAMIC 11 PC ,12,8/10/2011 15:29,4.95,15494.0,United Kingdom
558264,23082,SET 6 PAPER TABLE LANTERN HEARTS ,6,6/28/2011 9:10,3.75,16473.0,United Kingdom
578270,21901,"KEY FOB , BACK DOOR ",4,11/23/2011 13:39,1.63,14096.0,United Kingdom
576861,23328,SET 6 SCHOOL MILK BOTTLES IN CRATE,1,11/16/2011 16:00,3.75,18041.0,United Kingdom
538662,85170D,SET/6 PINK BIRD T-LIGHT CANDLES,24,12/13/2010 15:44,0.85,15159.0,United Kingdom
559163,85170D,SET/6 PINK BIRD T-LIGHT CANDLES,1,7/6/2011 16:33,2.46,,United Kingdom
559307,22730,ALARM CLOCK BAKELIKE IVORY,4,7/7/2011 13:02,3.75,15356.0,United Kingdom
550196,23156,SET OF 5 MINI GROCERY MAGNETS,1,4/15/2011 10:09,2.08,14796.0,United Kingdom
577507,84375,SET OF 20 KIDS COOKIE CUTTERS,2,11/20/2011 12:42,2.1,14710.0,United Kingdom
557263,21154,RED RETROSPOT OVEN GLOVE ,200,6/19/2011 11:08,1.06,14646.0,Netherlands
566250,22041,"RECORD FRAME 7"" SINGLE SIZE ",48,9/11/2011 12:10,2.1,15587.0,United Kingdom
549537,22262,FELT EGG COSY CHICKEN,1,4/8/2011 17:22,0.85,,United Kingdom
557208,23108,SET OF 10 LED DOLLY LIGHTS,4,6/17/2011 11:38,6.25,16172.0,United Kingdom
580367,23014,GLASS APOTHECARY BOTTLE ELIXIR,3,12/2/2011 16:39,8.29,,United Kingdom
569202,23008,DOLLY GIRL BABY GIFT SET,1,9/30/2011 17:22,10.79,,United Kingdom
580397,21876,POTTERING MUG,1,12/4/2011 11:24,1.65,13558.0,United Kingdom
C574347,23395,BELLE JARDINIERE CUSHION COVER,-3,11/4/2011 10:28,3.75,12500.0,Germany
579458,23274,STAR T-LIGHT HOLDER WILLIE WINKIE,1,11/29/2011 14:38,1.65,16549.0,United Kingdom
581217,23082,SET 6 PAPER TABLE LANTERN HEARTS ,4,12/8/2011 9:20,7.46,,United Kingdom
552860,22428,ENAMEL FIRE BUCKET CREAM,1,5/11/2011 16:26,6.95,17889.0,United Kingdom
568101,23353,6 GIFT TAGS VINTAGE CHRISTMAS ,12,9/23/2011 15:21,0.83,15978.0,United Kingdom
566281,23273,HEART T-LIGHT HOLDER WILLIE WINKIE,12,9/11/2011 14:15,1.65,12748.0,United Kingdom
575739,21642,ASSORTED TUTTI FRUTTI PEN,1,11/11/2011 9:05,1.63,,United Kingdom
550134,47566,PARTY BUNTING,8,4/14/2011 13:50,4.95,16249.0,United Kingdom
550205,22698,PINK REGENCY TEACUP AND SAUCER,2,4/15/2011 10:37,5.79,,United Kingdom
C563601,23160,REGENCY TEA SPOON,-3,8/18/2011 6:25,1.25,13047.0,United Kingdom
555726,23275,SET OF 3 HANGING OWLS OLLIE BEAK,12,6/6/2011 16:23,1.25,12540.0,Spain
547709,22507,MEMO BOARD RETROSPOT  DESIGN,1,3/24/2011 18:43,4.95,18109.0,United Kingdom
561005,21198,WHITE HEART CONFETTI IN TUBE,5,7/22/2011 14:53,1.65,17961.0,United Kingdom
546977,20727,LUNCH BAG  BLACK SKULL.,3,3/18/2011 12:08,4.96,,United Kingdom
569568,84536B,FAIRY CAKES NOTEBOOK A7 SIZE,16,10/5/2011 9:57,0.42,12700.0,France
537624,20982,12 PENCILS TALL TUBE SKULLS,1,12/7/2010 14:41,0.85,12748.0,United Kingdom
575602,20975,12 PENCILS SMALL TUBE RED RETROSPOT,2,11/10/2011 12:27,0.65,17059.0,United Kingdom
544824,22968,ROSE COTTAGE KEEPSAKE BOX ,2,2/24/2011 9:32,9.95,17139.0,United Kingdom
558909,22748,POPPY'S PLAYHOUSE KITCHEN,12,7/5/2011 9:10,2.1,13408.0,United Kingdom
560224,85049G,CHOCOLATE BOX RIBBONS ,3,7/15/2011 16:06,1.25,14572.0,United Kingdom
565129,22980,PANTRY SCRUBBING BRUSH,1,9/1/2011 12:41,1.65,15719.0,United Kingdom
559914,84755,COLOUR GLASS T-LIGHT HOLDER HANGING,8,7/13/2011 15:13,1.24,,United Kingdom
574310,22791,T-LIGHT GLASS FLUTED ANTIQUE,12,11/3/2011 16:56,1.25,13467.0,United Kingdom
C564996,20726,LUNCH BAG WOODLAND,-1,8/31/2011 16:10,1.65,17677.0,United Kingdom
577106,21967,PACK OF 12 SKULL TISSUES,4,11/17/2011 17:18,0.39,14456.0,United Kingdom
570491,23412,HEART MIRROR ANTIQUE WHITE,1,10/10/2011 17:26,7.5,14395.0,United Kingdom
567099,23016,GLASS TWIST BON BON JAR,1,9/16/2011 13:31,7.85,15311.0,United Kingdom
539252,22610,PENS ASSORTED FUNNY FACE,72,12/16/2010 14:17,0.21,17744.0,United Kingdom
567530,22551,PLASTERS IN TIN SPACEBOY,12,9/21/2011 9:33,1.65,12390.0,Belgium
574709,22629,SPACEBOY LUNCH BOX ,3,11/6/2011 14:14,1.95,17768.0,United Kingdom
559506,20992,JAZZ HEARTS PURSE NOTEBOOK,6,7/8/2011 15:17,0.83,,United Kingdom
553172,23051,RECYCLED ACAPULCO MAT BLUE,4,5/13/2011 17:15,8.25,14031.0,United Kingdom
560539,21212,PACK OF 72 RETROSPOT CAKE CASES,48,7/19/2011 12:19,0.55,16745.0,United Kingdom
544778,22698,PINK REGENCY TEACUP AND SAUCER,2,2/23/2011 12:03,2.95,14978.0,United Kingdom
559817,20676,RED RETROSPOT BOWL,2,7/12/2011 16:20,2.46,,United Kingdom
575149,21137,BLACK RECORD COVER FRAME,4,11/8/2011 15:59,3.75,16626.0,United Kingdom
536531,21333,CLASSIC WHITE FRAME,12,12/1/2010 13:23,2.95,15485.0,United Kingdom
547663,23126,FELTCRAFT GIRL AMELIE KIT,1,3/24/2011 13:16,4.95,16022.0,United Kingdom
577320,23571,TRADITIONAL NAUGHTS & CROSSES,12,11/18/2011 13:44,1.65,13880.0,United Kingdom
578950,22555,PLASTERS IN TIN STRONGMAN,1,11/27/2011 14:40,1.65,17885.0,United Kingdom
573153,23287,RED VINTAGE SPOT BEAKER,16,10/28/2011 7:39,0.85,12678.0,France
580727,21868,POTTING SHED TEA MUG,2,12/5/2011 17:17,3.29,14096.0,United Kingdom
551173,84916,HAND TOWEL PALE BLUE W FLOWERS,1,4/26/2011 16:54,4.13,,United Kingdom
581219,21878,PACK OF 6 SANDCASTLE FLAGS ASSORTED,1,12/8/2011 9:28,1.63,,United Kingdom
576597,22818,CARD CHRISTMAS VILLAGE,72,11/15/2011 14:57,0.36,14194.0,United Kingdom
551014,23137,ZINC WIRE SWEETHEART LETTER TRAY,4,4/26/2011 11:04,3.75,13209.0,United Kingdom
536538,21466,RED FLOWER CROCHET FOOD COVER,1,12/1/2010 13:54,3.75,14594.0,United Kingdom
550817,85194L,HANGING SPRING FLOWER EGG LARGE,10,4/20/2011 17:00,0.85,17946.0,United Kingdom
548373,22026,BANQUET BIRTHDAY  CARD  ,1,3/30/2011 16:34,0.83,,United Kingdom
567721,22039,BOTANICAL LILY GIFT WRAP,100,9/22/2011 10:38,0.42,12409.0,Switzerland
579512,22698,PINK REGENCY TEACUP AND SAUCER,3,11/29/2011 16:47,5.79,,United Kingdom
559056,21401,BLUE PUDDING SPOON,24,7/6/2011 9:15,0.12,14645.0,United Kingdom
569687,23206,LUNCH BAG APPLE DESIGN,10,10/5/2011 14:53,1.65,13709.0,United Kingdom
564184,21123,SET/10 IVORY POLKADOT PARTY CANDLES,24,8/23/2011 15:11,1.25,,EIRE
567473,23301,GARDENERS KNEELING PAD KEEP CALM ,2,9/20/2011 12:50,1.65,17841.0,United Kingdom
565231,22955,36 FOIL STAR CAKE CASES ,1,9/2/2011 9:26,4.13,,United Kingdom
568060,23511,EMBROIDERED RIBBON REEL EMILY ,2,9/23/2011 13:11,2.08,14546.0,United Kingdom
563950,22961,JAM MAKING SET PRINTED,24,8/22/2011 10:39,1.45,12471.0,Germany
561214,22654,DELUXE SEWING KIT ,1,7/25/2011 17:00,11.63,,United Kingdom
542622,21698,MOCK LOBSTER FRIDGE MAGNET,1,1/31/2011 9:09,1.63,,United Kingdom
539958,90214M,"LETTER ""M"" BLING KEY RING",1,12/23/2010 13:26,0.85,,United Kingdom
C576324,20973,12 PENCIL SMALL TUBE WOODLAND,-2,11/14/2011 15:10,0.65,16161.0,United Kingdom
547418,22423,REGENCY CAKESTAND 3 TIER,1,3/23/2011 10:25,12.75,13148.0,United Kingdom
557790,21908,CHOCOLATE THIS WAY METAL SIGN,12,6/22/2011 16:33,2.1,14099.0,United Kingdom
542864,22222,CAKE PLATE LOVEBIRD WHITE,24,2/1/2011 12:03,1.95,13802.0,United Kingdom
578746,22112,CHOCOLATE HOT WATER BOTTLE,18,11/25/2011 11:36,12.46,,United Kingdom
575918,22496,SET OF 2 ROUND TINS DUTCH CHEESE,1,11/11/2011 16:58,2.95,17191.0,United Kingdom
542993,35923,CANDY HEART HANGING DECORATION,12,2/2/2011 12:02,1.25,16156.0,United Kingdom
574533,22568,FELTCRAFT CUSHION OWL,8,11/4/2011 14:24,3.75,12928.0,United Kingdom
576076,22386,JUMBO BAG PINK POLKADOT,1,11/13/2011 16:18,2.08,14382.0,United Kingdom
574920,23480,MINI LIGHTS WOODLAND MUSHROOMS,4,11/7/2011 16:34,3.75,13985.0,United Kingdom
574555,22675,FRENCH KITCHEN SIGN BLUE METAL,2,11/4/2011 15:29,1.25,16426.0,United Kingdom
560291,84993a,75 GREEN PETIT FOUR CASES,2,7/18/2011 10:17,0.83,,United Kingdom
559794,22994,TRAVEL CARD WALLET RETROSPOT,24,7/12/2011 13:16,0.42,16700.0,United Kingdom
561893,23209,LUNCH BAG DOILEY PATTERN ,1,7/31/2011 14:39,1.65,12942.0,United Kingdom
538883,22208,WOOD STAMP SET THANK YOU,1,12/14/2010 15:56,3.36,,United Kingdom
558647,20969,RED FLORAL FELTCRAFT SHOULDER BAG,4,7/1/2011 10:39,3.75,14868.0,United Kingdom
565460,22667,RECIPE BOX RETROSPOT ,6,9/5/2011 9:24,2.95,16843.0,United Kingdom
577106,72351B,SET/6 PINK  BUTTERFLY T-LIGHTS,1,11/17/2011 17:18,2.1,14456.0,United Kingdom
578044,20969,RED FLORAL FELTCRAFT SHOULDER BAG,4,11/22/2011 14:41,3.75,13488.0,United Kingdom
540418,16225,RATTLE SNAKE EGGS,3,1/7/2011 11:04,0.85,,United Kingdom
546656,22355,CHARLOTTE BAG SUKI DESIGN,4,3/15/2011 14:19,2.46,,United Kingdom
C562921,22699,ROSES REGENCY TEACUP AND SAUCER ,-2,8/10/2011 14:17,2.95,13767.0,United Kingdom
544770,20725,LUNCH BAG RED RETROSPOT,1,2/23/2011 11:11,4.96,,United Kingdom
571715,23189,SET OF 12 FORK CANDLES,4,10/18/2011 17:04,2.89,17576.0,United Kingdom
580156,23341,PINK DINER WALL CLOCK,4,12/2/2011 10:32,8.5,14897.0,United Kingdom
566495,23436,VINTAGE CHRISTMAS GIFT BAG LARGE ,20,9/13/2011 11:14,1.25,15529.0,United Kingdom
574561,21251,DINOSAUR HEIGHT CHART STICKER SET,1,11/4/2011 15:52,5.79,,United Kingdom
574253,23177,TREASURE ISLAND BOOK BOX,8,11/3/2011 13:30,2.25,15252.0,United Kingdom
574898,23343,JUMBO BAG VINTAGE CHRISTMAS ,10,11/7/2011 15:07,2.08,16242.0,United Kingdom
541858,21509,COWBOYS AND INDIANS BIRTHDAY CARD ,12,1/23/2011 15:34,0.42,16983.0,United Kingdom
567966,21115,ROSE CARAVAN DOORSTOP,2,9/23/2011 9:26,6.75,16782.0,United Kingdom
575735,21326,AGED GLASS SILVER T-LIGHT HOLDER,12,11/11/2011 8:46,0.65,14156.0,EIRE
557621,21889,WOODEN BOX OF DOMINOES,12,6/21/2011 14:00,1.25,12444.0,Norway
569129,21754,HOME BUILDING BLOCK WORD,1,9/30/2011 13:40,6.25,15034.0,United Kingdom
541592,22303,COFFEE MUG APPLES DESIGN,2,1/19/2011 15:08,4.96,,United Kingdom
577358,23120,PACK OF 6 SMALL FRUIT STRAWS,1,11/18/2011 15:59,0.79,,United Kingdom
550320,84459A,PINK METAL CHICKEN HEART ,2,4/17/2011 12:37,1.49,12748.0,United Kingdom
540551,22966,GINGERBREAD MAN COOKIE CUTTER,1,1/10/2011 9:43,2.51,,United Kingdom
561195,22063,CERAMIC BOWL WITH STRAWBERRY DESIGN,3,7/25/2011 13:57,2.95,14796.0,United Kingdom
580983,23223,CHRISTMAS TREE HANGING SILVER ,2,12/6/2011 16:26,1.63,,United Kingdom
556083,85099B,JUMBO BAG RED RETROSPOT,7,6/8/2011 15:23,4.13,,United Kingdom
577768,22166,WALL MIRROR RECTANGLE DIAMANTE PINK,1,11/21/2011 15:18,7.46,,United Kingdom
548158,20748,KENSINGTON COFFEE SET,3,3/29/2011 13:28,12.75,15906.0,United Kingdom
574833,22617,BAKING SET SPACEBOY DESIGN,3,11/7/2011 11:29,4.95,12827.0,United Kingdom
545215,21733,RED HANGING HEART T-LIGHT HOLDER,9,2/28/2011 16:47,2.95,,United Kingdom
C566751,22796,PHOTO FRAME 3 CLASSIC HANGING,-2,9/14/2011 15:42,9.95,14911.0,EIRE
574491,22367,CHILDRENS APRON SPACEBOY DESIGN,8,11/4/2011 13:05,1.95,16318.0,United Kingdom
562457,21212,PACK OF 72 RETROSPOT CAKE CASES,24,8/5/2011 11:00,0.55,18079.0,United Kingdom
544154,15036,ASSORTED COLOURS SILK FAN,600,2/16/2011 12:13,0.65,13414.0,United Kingdom
548728,84375,SET OF 20 KIDS COOKIE CUTTERS,12,4/4/2011 9:55,2.1,13198.0,United Kingdom
578472,22467,GUMBALL COAT RACK,12,11/24/2011 12:40,2.55,12476.0,Germany
543370,22847,BREAD BIN DINER STYLE IVORY,2,2/7/2011 14:51,16.95,12359.0,Cyprus
558328,16156S,WRAP PINK FAIRY CAKES ,25,6/28/2011 12:09,0.42,15146.0,United Kingdom
567043,79066K,RETRO MOD TRAY,24,9/16/2011 11:27,0.85,13268.0,United Kingdom
577497,22175,PINK OWL SOFT TOY,1,11/20/2011 12:22,2.95,17555.0,United Kingdom
576696,21731,RED TOADSTOOL LED NIGHT LIGHT,1,11/16/2011 12:26,1.65,16669.0,United Kingdom
541811,47518f,ICON PLACEMAT POP ART ELVIS,1,1/21/2011 15:01,4.13,,United Kingdom
566562,22537,MAGIC DRAWING SLATE DINOSAUR,48,9/13/2011 12:18,0.42,17365.0,United Kingdom
559337,22342,HOME GARLAND PAINTED ZINC ,2,7/7/2011 16:27,1.63,,United Kingdom
569248,22950,36 DOILIES VINTAGE CHRISTMAS,12,10/3/2011 10:09,1.45,12886.0,United Kingdom
569220,20971,PINK BLUE FELT CRAFT TRINKET BOX,4,10/2/2011 13:26,1.25,16007.0,United Kingdom
543652,21242,RED RETROSPOT PLATE ,8,2/11/2011 10:15,1.69,15544.0,United Kingdom
540681,22356,CHARLOTTE BAG PINK POLKADOT,3,1/10/2011 16:25,1.66,,United Kingdom
558614,22609,PENS ASSORTED SPACEBALL,23,6/30/2011 15:56,0.42,,United Kingdom
539437,21991,BOHEMIAN COLLAGE STATIONERY SET,1,12/17/2010 14:54,2.51,,United Kingdom
547514,84507B,STRIPES DESIGN MONKEY DOLL,6,3/23/2011 14:00,2.55,17486.0,United Kingdom
580290,21906,PHARMACIE FIRST AID TIN,1,12/2/2011 13:35,6.75,17221.0,United Kingdom
556542,22556,PLASTERS IN TIN CIRCUS PARADE ,4,6/13/2011 12:52,1.65,14719.0,United Kingdom
578347,21356,TOAST ITS - FAIRY FLOWER,4,11/24/2011 9:26,0.83,,United Kingdom
577973,21733,RED HANGING HEART T-LIGHT HOLDER,32,11/22/2011 12:13,2.55,13798.0,United Kingdom
549716,22998,TRAVEL CARD WALLET KEEP CALM,24,4/11/2011 14:43,0.42,14628.0,United Kingdom
565675,85123A,WHITE HANGING HEART T-LIGHT HOLDER,32,9/6/2011 9:51,2.55,15513.0,United Kingdom
546237,62086A,PINK RETRO BIG FLOWER BAG,6,3/10/2011 12:50,1.95,16625.0,United Kingdom
557118,22149,FELTCRAFT 6 FLOWER FRIENDS,6,6/16/2011 17:05,2.1,14849.0,United Kingdom
553006,21988,PACK OF 6 SKULL PAPER PLATES,12,5/12/2011 16:45,0.85,15544.0,United Kingdom
555249,22478,BIRDHOUSE GARDEN MARKER ,10,6/1/2011 14:57,1.25,17472.0,United Kingdom
541104,20801,LARGE PINK GLASS SUNDAE DISH,1,1/13/2011 14:29,2.46,,United Kingdom
565649,22844,VINTAGE CREAM DOG FOOD CONTAINER,2,9/5/2011 16:27,8.5,16712.0,United Kingdom
551517,84378,SET OF 3 HEART COOKIE CUTTERS,3,5/1/2011 11:14,1.25,16931.0,United Kingdom
553192,20967,GREY FLORAL FELTCRAFT SHOULDER BAG,3,5/15/2011 13:27,3.75,15333.0,United Kingdom
547547,22241,GARLAND WOODEN HAPPY EASTER,1,3/23/2011 15:30,2.46,,United Kingdom
573841,20914,SET/5 RED RETROSPOT LID GLASS BOWLS,1,11/1/2011 11:39,2.95,14995.0,United Kingdom
562804,23209,LUNCH BAG DOILEY PATTERN ,10,8/9/2011 14:48,1.65,13355.0,United Kingdom
565854,84997C,CHILDRENS CUTLERY POLKADOT BLUE,8,9/7/2011 13:22,4.15,12490.0,France
546310,82486,WOOD S/3 CABINET ANT WHITE FINISH,12,3/10/2011 16:26,8.15,15291.0,United Kingdom
578015,22595,GINGHAM HEART DECORATION,48,11/22/2011 12:58,0.85,12971.0,United Kingdom
580301,23571,TRADITIONAL NAUGHTS & CROSSES,12,12/2/2011 14:11,1.65,15271.0,United Kingdom
567507,22149,FELTCRAFT 6 FLOWER FRIENDS,1,9/20/2011 14:46,4.96,,United Kingdom
550137,22692,DOORMAT WELCOME TO OUR HOME,10,4/14/2011 13:59,6.75,12477.0,Germany
563924,82483,WOOD 2 DRAWER CABINET WHITE FINISH,1,8/21/2011 14:32,6.95,15984.0,United Kingdom
562574,84949,SILVER HANGING T-LIGHT HOLDER,6,8/7/2011 12:42,1.65,14903.0,United Kingdom
560504,15056BL,EDWARDIAN PARASOL BLACK,3,7/19/2011 11:47,5.95,13081.0,United Kingdom
559898,22469,HEART OF WICKER SMALL,4,7/13/2011 12:18,1.65,16225.0,United Kingdom
578093,21499,BLUE POLKADOT WRAP,50,11/22/2011 17:21,0.42,14911.0,EIRE
580115,23113,PANTRY CHOPPING BOARD,1,12/1/2011 16:22,10.79,,United Kingdom
578233,21902,"KEY FOB , FRONT  DOOR ",1,11/23/2011 12:20,0.65,14049.0,United Kingdom
575930,21231,SWEETHEART CERAMIC TRINKET BOX,2,11/11/2011 17:58,2.46,,United Kingdom
576339,47480,HANGING PHOTO CLIP ROPE LADDER,3,11/14/2011 15:27,3.29,14096.0,United Kingdom
558475,22326,ROUND SNACK BOXES SET OF4 WOODLAND ,3,6/29/2011 15:58,5.79,,United Kingdom
573248,23300,GARDENERS KNEELING PAD CUP OF TEA ,4,10/28/2011 12:09,1.65,14498.0,United Kingdom
580501,22866,HAND WARMER SCOTTY DOG DESIGN,2,12/4/2011 13:00,2.1,14546.0,United Kingdom
572121,23372,SET 36 COLOUR PENCILS DOLLY GIRL,6,10/20/2011 19:51,1.25,17092.0,United Kingdom
544406,20767,BLUE PAISLEY JOURNAL ,2,2/18/2011 13:26,2.55,16726.0,United Kingdom
581125,16216,LETTER SHAPE PENCIL SHARPENER,25,12/7/2011 12:41,0.06,14087.0,United Kingdom
554097,20675,BLUE POLKADOT BOWL,8,5/22/2011 13:01,1.25,12567.0,France
546435,22127,PARTY CONES CARNIVAL ASSORTED,12,3/14/2011 9:37,1.25,15671.0,United Kingdom
565396,21080,SET/20 RED RETROSPOT PAPER NAPKINS ,1,9/2/2011 16:39,1.63,,United Kingdom
544190,85016,SET OF 6 VINTAGE NOTELETS KIT,6,2/16/2011 16:56,2.55,13089.0,United Kingdom
560772,22505,MEMO BOARD COTTAGE DESIGN,7,7/20/2011 16:12,5.79,,United Kingdom
561246,22991,GIRAFFE WOODEN RULER,12,7/26/2011 11:38,1.95,16951.0,United Kingdom
574874,21929,JUMBO BAG PINK VINTAGE PAISLEY,10,11/7/2011 13:06,2.08,14911.0,EIRE
576076,22609,PENS ASSORTED SPACEBALL,72,11/13/2011 16:18,0.19,14382.0,United Kingdom
565840,22546,MINI JIGSAW PURDEY,1,9/7/2011 12:02,0.83,,United Kingdom
545019,21507,"ELEPHANT, BIRTHDAY CARD, ",24,2/25/2011 13:56,0.42,15093.0,United Kingdom
574328,21121,SET/10 RED POLKADOT PARTY CANDLES,24,11/4/2011 9:05,1.25,13081.0,United Kingdom
550778,22301,COFFEE MUG CAT + BIRD DESIGN,6,4/20/2011 13:36,2.55,14868.0,United Kingdom
560255,23021,GLASS BONNE JAM JAR,3,7/17/2011 13:08,4.15,16054.0,United Kingdom
562602,23292,SPACEBOY CHILDRENS CUP,8,8/8/2011 10:11,1.25,12865.0,Austria
556576,82494L,WOODEN FRAME ANTIQUE WHITE ,2,6/13/2011 13:55,2.95,14606.0,United Kingdom
576392,21926,RED/CREAM STRIPE CUSHION COVER ,12,11/15/2011 10:17,1.25,15105.0,United Kingdom
560716,20972,PINK CREAM FELT CRAFT TRINKET BOX ,12,7/20/2011 13:26,1.25,17675.0,United Kingdom
558382,20847,ZINC HEART LATTICE CHARGER LARGE,12,6/28/2011 17:28,3.75,17997.0,United Kingdom
541696,84692,BOX OF 24 COCKTAIL PARASOLS,2,1/20/2011 18:08,0.83,,United Kingdom
566554,23203,JUMBO BAG VINTAGE DOILY ,20,9/13/2011 11:39,2.08,13136.0,United Kingdom
580059,22197,POPCORN HOLDER,50,12/1/2011 13:22,0.85,17768.0,United Kingdom
565434,22962,JAM JAR WITH PINK LID,6,9/4/2011 13:35,0.85,12867.0,United Kingdom
569898,82583,HOT BATHS METAL SIGN,2,10/6/2011 16:08,4.13,,United Kingdom
570884,22905,CALENDAR IN SEASON DESIGN,1,10/13/2011 10:09,2.95,17315.0,United Kingdom
567092,23192,BUNDLE OF 3 ALPHABET EXERCISE BOOKS,12,9/16/2011 12:48,1.65,13196.0,United Kingdom
568712,23191,BUNDLE OF 3 RETRO NOTE BOOKS,1,9/28/2011 15:50,1.65,17841.0,United Kingdom
543300,47310M,"SMALL POP BOX,FUNKY MONKEY",3,2/7/2011 11:42,1.25,13334.0,United Kingdom
569780,23201,JUMBO BAG ALPHABET,10,10/6/2011 11:38,2.08,13199.0,United Kingdom
581219,21620,SET OF 4 ROSE BOTANICAL CANDLES,3,12/8/2011 9:28,3.29,,United Kingdom
557937,22269,EGG CUP NATURAL CHICKEN,2,6/23/2011 15:30,0.83,,United Kingdom
558888,23197,SKETCHBOOK MAGNETIC SHOPPING LIST,3,7/4/2011 15:29,1.45,14056.0,United Kingdom
562593,47590B,PINK HAPPY BIRTHDAY BUNTING,1,8/7/2011 15:43,5.45,16549.0,United Kingdom
540976,21955,DOORMAT UNION JACK GUNS AND ROSES,2,1/12/2011 15:00,7.95,12652.0,France
565733,23328,SET 6 SCHOOL MILK BOTTLES IN CRATE,4,9/6/2011 12:11,3.75,16359.0,United Kingdom
571117,23047,PAPER LANTERN 5 POINT SEQUIN STAR,2,10/13/2011 17:51,5.75,16224.0,United Kingdom
551872,10133,COLOURING PENCILS BROWN TUBE,10,5/4/2011 17:19,0.85,12955.0,United Kingdom
561020,21361,LOVE LARGE WOOD LETTERS ,1,7/22/2011 17:21,12.75,13563.0,United Kingdom
572662,84030E,ENGLISH ROSE HOT WATER BOTTLE,2,10/25/2011 12:54,4.25,15443.0,United Kingdom
564818,22203,MILK PAN RED RETROSPOT,1,8/30/2011 12:10,7.46,,United Kingdom
539607,21700,BIG DOUGHNUT FRIDGE MAGNETS,24,12/20/2010 14:10,0.85,12681.0,France
574741,22423,REGENCY CAKESTAND 3 TIER,1,11/6/2011 16:13,12.75,15993.0,United Kingdom
549524,21864,UNION JACK FLAG PASSPORT COVER ,1,4/8/2011 15:42,4.13,,United Kingdom
580367,84032A,CHARLIE+LOLA PINK HOT WATER BOTTLE,3,12/2/2011 16:39,3.29,,United Kingdom
574298,22314,OFFICE MUG WARMER CHOC+BLUE,1,11/3/2011 15:56,5.79,,United Kingdom
558614,22807,SET OF 6 T-LIGHTS TOADSTOOLS,7,6/30/2011 15:56,2.46,,United Kingdom
541965,22556,PLASTERS IN TIN CIRCUS PARADE ,12,1/24/2011 13:27,1.65,12625.0,Germany
580305,21745,GAOLERS KEYS DECORATIVE GARDEN ,1,12/2/2011 14:26,3.75,12970.0,United Kingdom
548165,22371,AIRLINE BAG VINTAGE TOKYO 78,1,3/29/2011 13:44,8.29,,United Kingdom
558867,23099,FRENCH CARRIAGE LANTERN,2,7/4/2011 12:41,6.65,17765.0,United Kingdom
568494,22291,HANGING CHICK CREAM DECORATION,6,9/27/2011 12:08,1.45,16266.0,United Kingdom
568667,21901,"KEY FOB , BACK DOOR ",2,9/28/2011 13:00,0.65,14606.0,United Kingdom
540821,21556,CERAMIC STRAWBERRY MONEY BOX,3,1/11/2011 13:16,2.51,,United Kingdom
550328,35961,FOLKART ZINC HEART CHRISTMAS DEC,1,4/17/2011 13:18,0.85,17582.0,United Kingdom
572567,20718,RED RETROSPOT SHOPPER BAG,10,10/25/2011 10:27,1.25,12398.0,Switzerland
578936,22098,BOUDOIR SQUARE TISSUE BOX,2,11/27/2011 13:00,0.39,16923.0,United Kingdom
569631,22748,POPPY'S PLAYHOUSE KITCHEN,6,10/5/2011 11:53,2.1,13483.0,United Kingdom
570718,POST,POSTAGE,2,10/12/2011 10:36,18.0,12518.0,Germany
558705,37413,ICON MUG REVOLUTIONARY,1,7/1/2011 12:52,0.39,12748.0,United Kingdom
540813,22563,HAPPY STENCIL CRAFT,6,1/11/2011 12:41,1.25,14669.0,United Kingdom
580513,22400,MAGNETS PACK OF 4 HOME SWEET HOME,1,12/4/2011 13:59,0.39,14456.0,United Kingdom
